<?xml version="1.0" encoding="UTF-8"?>
<xs:schema xmlns:xs="http://www.w3.org/2001/XMLSchema" elementFormDefault="qualified">

    <xs:element name="Ingredientes">
        <xs:complexType>
            <xs:sequence>
                <xs:element name="ingredient" maxOccurs="unbounded">
                    <xs:complexType>
                        <xs:sequence>
                            <xs:element name="name" type="xs:string"/>
                            <xs:element name="categories">
                                <xs:simpleType>
                                    <xs:restriction base="xs:string">
                                        <xs:enumeration value="Vegetal"/>
                                        <xs:enumeration value="Dairy"/>
                                        <xs:enumeration value="Sauce"/>
                                        <xs:enumeration value="Herb"/>
                                        <xs:enumeration value="Meat"/>
                                        <xs:enumeration value="Pasta"/>
                                    </xs:restriction>
                                </xs:simpleType>
                            </xs:element>
                            <xs:element name="calories">
                                <xs:complexType>
                                    <xs:simpleContent>
                                        <xs:extension base="xs:string">
                                            <xs:attribute name="unit">
                                                <xs:simpleType>
                                                  <xs:restriction base="xs:string">
                                                  <xs:enumeration value="grams"/>
                                                  <xs:enumeration value="mililiters"/>
                                                  <xs:enumeration value="unidades"/>
                                                  </xs:restriction>
                                                </xs:simpleType>
                                            </xs:attribute>
                                        </xs:extension>
                                    </xs:simpleContent>
                                </xs:complexType>
                            </xs:element>
                        </xs:sequence>
                    </xs:complexType>
                </xs:element>
            </xs:sequence>
        </xs:complexType>
    </xs:element>
</xs:schema>
